{
	"$schema": "./schemas/catalog.schema.json",
	"schemaVersion": 1,
	"surfaces": [
		"scomm",
		"office"
	],
	"platforms": [
		"windows",
		"macos",
		"linux"
	],
	"hosts": {
		"scommDesktop": {
			"surfaces": [
				"scomm"
			]
		}
	},
	"products": {
		"Scomm": {
			"description": "Scomm Desktop base license and optional add-ons: AI-Assistant, Post-Quantum E2EE, Custom Colours & Backgrounds, and the Basic Bundle",
			"isActive": true,
			"offerings": {
				"desktop": {
					"displayName": "Scomm Desktop",
					"resources": {
						"addonCode": "desktop",
						"surfaces": [
							"scomm"
						],
						"maxDevices": 3
					}
				},
				"pqc": {
					"displayName": "Post-Quantum E2EE",
					"resources": {
						"addonCode": "pqc",
						"surfaces": [
							"scomm"
						],
						"maxDevices": 3,
						"requiresOfferings": [
							"desktop"
						]
					}
				},
				"ai_assistant": {
					"displayName": "AI-Assistant",
					"resources": {
						"addonCode": "ai_assistant",
						"surfaces": [
							"scomm"
						],
						"maxDevices": 3,
						"requiresOfferings": [
							"desktop"
						]
					}
				},
				"accent_color": {
					"displayName": "Custom Colours & Backgrounds",
					"resources": {
						"addonCode": "accent_color",
						"surfaces": [
							"scomm"
						],
						"maxDevices": 3,
						"requiresOfferings": [
							"desktop"
						]
					}
				},
				"campaign_manager": {
					"displayName": "Campaign-Manager",
					"resources": {
						"addonCode": "campaign_manager",
						"surfaces": [
							"scomm"
						],
						"maxDevices": 3,
						"requiresOfferings": [
							"desktop"
						]
					}
				},
				"driving_mode": {
					"displayName": "Driving-Mode",
					"resources": {
						"addonCode": "driving_mode",
						"surfaces": [
							"scomm"
						],
						"maxDevices": 3,
						"requiresOfferings": [
							"desktop"
						]
					}
				},
				"linux": {
					"displayName": "Scomm Linux",
					"resources": {
						"addonCode": "linux",
						"surfaces": [
							"scomm"
						],
						"maxDevices": 3,
						"satisfiesOfferings": [
							"desktop"
						]
					},
					"isActive": false
				},
				"pgp": {
					"displayName": "Outlook OpenPGP ECC",
					"resources": {
						"addonCode": "pgp",
						"surfaces": [
							"office"
						],
						"maxDevices": 3
					},
					"isActive": false
				}
			},
			"plans": {
				"Scomm Desktop": {
					"description": "Base license for Scomm.AI on Windows, macOS and Linux. Required for every other add-on. One license covers up to 3 devices.",
					"trialDays": 30,
					"offeringCodes": [
						"desktop"
					],
					"pricings": {
						"annual": {
							"currency": "USD",
							"basePrice": 10
						}
					}
				},
				"AI-Assistant": {
					"description": "Integrated local and cloud AI",
					"trialDays": 30,
					"offeringCodes": [
						"ai_assistant"
					],
					"pricings": {
						"annual": {
							"currency": "USD",
							"basePrice": 10
						}
					}
				},
				"Post-Quantum E2EE": {
					"description": "Post-Quantum cryptography",
					"trialDays": 30,
					"offeringCodes": [
						"pqc"
					],
					"pricings": {
						"annual": {
							"currency": "USD",
							"basePrice": 15
						}
					}
				},
				"Custom Colours & Backgrounds": {
					"description": "Unlock the full colour spectrum for accent colours and custom background gradients.",
					"trialDays": 30,
					"offeringCodes": [
						"accent_color"
					],
					"pricings": {
						"annual": {
							"currency": "USD",
							"basePrice": 5
						}
					}
				},
				"Basic Bundle": {
					"description": "Scomm Desktop, AI-Assistant, Post-Quantum E2EE, and Custom Colours & Backgrounds in one bundle.",
					"trialDays": 30,
					"offeringCodes": [
						"desktop",
						"ai_assistant",
						"pqc",
						"accent_color"
					],
					"pricings": {
						"annual": {
							"currency": "USD",
							"basePrice": 25
						}
					}
				},
				"Campaign-Manager": {
					"description": "Plan and run email campaigns.",
					"trialDays": 30,
					"offeringCodes": [
						"campaign_manager"
					],
					"pricings": {
						"annual": {
							"currency": "USD",
							"basePrice": 15
						}
					},
					"isActive": false
				},
				"Driving-Mode": {
					"description": "Hands-free mail while driving.",
					"trialDays": 30,
					"offeringCodes": [
						"driving_mode"
					],
					"pricings": {
						"annual": {
							"currency": "USD",
							"basePrice": 15
						}
					},
					"isActive": false
				},
				"Scomm Linux": {
					"description": "Retired: replaced by Scomm Desktop.",
					"trialDays": 30,
					"offeringCodes": [
						"linux"
					],
					"pricings": {
						"annual": {
							"currency": "USD",
							"basePrice": 10
						}
					},
					"isActive": false
				},
				"Linux Version": {
					"description": "Retired: replaced by Scomm Desktop.",
					"trialDays": 30,
					"offeringCodes": [
						"linux"
					],
					"pricings": {
						"annual": {
							"currency": "USD",
							"basePrice": 5
						}
					},
					"isActive": false
				},
				"Local-AI": {
					"description": "Retired: renamed AI-Assistant.",
					"trialDays": 30,
					"offeringCodes": [
						"ai_assistant"
					],
					"pricings": {
						"annual": {
							"currency": "USD",
							"basePrice": 10
						}
					},
					"isActive": false
				},
				"Outlook OpenPGP ECC": {
					"description": "Retired: the Outlook add-in is not sold.",
					"trialDays": 30,
					"offeringCodes": [
						"pgp"
					],
					"pricings": {
						"annual": {
							"currency": "USD",
							"basePrice": 5
						}
					},
					"isActive": false
				},
				"Outlook OpenPGP ECC+PQC": {
					"description": "Retired: renamed Post-Quantum E2EE.",
					"trialDays": 30,
					"offeringCodes": [
						"pqc"
					],
					"pricings": {
						"annual": {
							"currency": "USD",
							"basePrice": 15
						}
					},
					"isActive": false
				},
				"All Add-ons Bundle": {
					"description": "Retired: replaced by the Basic Bundle.",
					"trialDays": 30,
					"offeringCodes": [
						"pgp",
						"pqc",
						"linux",
						"ai_assistant",
						"accent_color"
					],
					"pricings": {
						"annual": {
							"currency": "USD",
							"basePrice": 25
						}
					},
					"isActive": false
				}
			}
		}
	}
}
