{
	"$schema": "../../schemas/catalog.schema.json",
	"schemaVersion": 1,
	"surfaces": ["secmail", "office"],
	"platforms": ["linux"],
	"hosts": {
		"secmailDesktop": {
			"surfaces": ["secmail"],
			"excludePlatforms": ["linux"]
		},
		"secmailLinux": {
			"surfaces": ["secmail"]
		},
		"office": {
			"surfaces": ["office"],
			"excludePlatforms": ["linux"]
		}
	},
	"products": {
		"SecMail": {
			"description": "Scomm Email and Office add-ons",
			"isActive": true,
			"offerings": {
				"pgp": {
					"displayName": "Outlook OpenPGP ECC",
					"resources": {
						"addonCode": "pgp",
						"surfaces": ["office"]
					}
				},
				"pqc": {
					"displayName": "Outlook OpenPGP ECC+PQC",
					"resources": {
						"addonCode": "pqc",
						"surfaces": ["secmail", "office"]
					}
				},
				"linux": {
					"displayName": "Linux Version",
					"resources": {
						"addonCode": "linux",
						"surfaces": ["secmail"],
						"platforms": ["linux"]
					}
				},
				"ai_assistant": {
					"displayName": "Local-AI",
					"resources": {
						"addonCode": "ai_assistant",
						"surfaces": ["secmail", "office"]
					}
				}
			},
			"plans": {
				"Outlook OpenPGP ECC": {
					"offeringCodes": ["pgp"],
					"pricings": {
						"annual": {
							"currency": "USD",
							"basePrice": 5
						}
					}
				},
				"Outlook OpenPGP ECC+PQC": {
					"offeringCodes": ["pqc"],
					"pricings": {
						"annual": {
							"currency": "USD",
							"basePrice": 15
						}
					}
				},
				"Linux Version": {
					"offeringCodes": ["linux"],
					"pricings": {
						"annual": {
							"currency": "USD",
							"basePrice": 5
						}
					}
				},
				"Local-AI": {
					"offeringCodes": ["ai_assistant"],
					"pricings": {
						"annual": {
							"currency": "USD",
							"basePrice": 5
						}
					}
				}
			}
		}
	}
}
