{
	"$schema": "../../schemas/catalog.schema.json",
	"schemaVersion": 1,
	"surfaces": ["scomm", "office"],
	"platforms": ["linux"],
	"hosts": {
		"scommDesktop": {
			"surfaces": ["scomm"],
			"excludePlatforms": ["linux"]
		},
		"scommLinux": {
			"surfaces": ["scomm"]
		},
		"office": {
			"surfaces": ["office"],
			"excludePlatforms": ["linux"]
		}
	},
	"products": {
		"Scomm": {
			"description": "Scomm Email and Office add-ons",
			"isActive": true,
			"offerings": {
				"pgp": {
					"displayName": "Outlook OpenPGP ECC",
					"resources": {
						"addonCode": "pgp",
						"surfaces": ["office"]
					}
				},
				"pqc": {
					"displayName": "Outlook OpenPGP ECC+PQC",
					"resources": {
						"addonCode": "pqc",
						"surfaces": ["scomm", "office"]
					}
				},
				"linux": {
					"displayName": "Linux Version",
					"resources": {
						"addonCode": "linux",
						"surfaces": ["scomm"],
						"platforms": ["linux"]
					}
				},
				"ai_assistant": {
					"displayName": "Local-AI",
					"resources": {
						"addonCode": "ai_assistant",
						"surfaces": ["scomm", "office"]
					}
				},
				"accent_color": {
					"displayName": "Custom Colours & Backgrounds",
					"resources": {
						"addonCode": "accent_color",
						"surfaces": ["scomm"]
					}
				}
			},
			"plans": {
				"Outlook OpenPGP ECC": {
					"trialDays": 30,
					"offeringCodes": ["pgp"],
					"pricings": {
						"annual": {
							"currency": "USD",
							"basePrice": 5
						}
					}
				},
				"Outlook OpenPGP ECC+PQC": {
					"trialDays": 30,
					"offeringCodes": ["pqc"],
					"pricings": {
						"annual": {
							"currency": "USD",
							"basePrice": 15
						}
					}
				},
				"Linux Version": {
					"trialDays": 30,
					"offeringCodes": ["linux"],
					"pricings": {
						"annual": {
							"currency": "USD",
							"basePrice": 5
						}
					}
				},
				"Local-AI": {
					"trialDays": 30,
					"offeringCodes": ["ai_assistant"],
					"pricings": {
						"annual": {
							"currency": "USD",
							"basePrice": 5
						}
					}
				},
				"Custom Colours & Backgrounds": {
					"trialDays": 30,
					"offeringCodes": ["accent_color"],
					"pricings": {
						"annual": {
							"currency": "USD",
							"basePrice": 5
						}
					}
				},
				"All Add-ons Bundle": {
					"trialDays": 30,
					"offeringCodes": ["pgp", "pqc", "linux", "ai_assistant", "accent_color"],
					"pricings": {
						"annual": {
							"currency": "USD",
							"basePrice": 25
						}
					}
				}
			}
		}
	}
}
